smartctl 7.5 2025-04-30 r5714 [x86_64-w64-mingw32-w11-b26220] (AppVeyor)
Copyright (C) 2002-25, Bruce Allen, Christian Franke, www.smartmontools.org

=== START OF INFORMATION SECTION ===
Model Number:                       THNSF5256GPUK TOSHIBA
Serial Number:                      ****TALT
Firmware Version:                   51055KLA
PCI Vendor/Subsystem ID:            0x1179
IEEE OUI Identifier:                0x00080d
Controller ID:                      0
NVMe Version:                       <1.2
Number of Namespaces:               1
Namespace 1 Size/Capacity:          256,060,514,304 [256 GB]
Namespace 1 Formatted LBA Size:     512
Namespace 1 IEEE EUI-64: [redacted]
Local Time is:                      Fri Jul 24 10:04:05 2026 EDT
Firmware Updates (0x02):            1 Slot
Optional Admin Commands (0x0017):   Security Format Frmw_DL Self_Test
Optional NVM Commands (0x001e):     Wr_Unc DS_Mngmt Wr_Zero Sav/Sel_Feat
Log Page Attributes (0x02):         Cmd_Eff_Lg
Warning  Comp. Temp. Threshold:     78 Celsius
Critical Comp. Temp. Threshold:     82 Celsius

Supported Power States
St Op     Max   Active     Idle   RL RT WL WT  Ent_Lat  Ex_Lat
 0 +     8.00W       -        -    0  0  0  0        0       0
 1 +     3.90W       -        -    1  1  1  1        0       0
 2 +     2.00W       -        -    2  2  2  2        0       0
 3 -   0.1200W       -        -    3  3  3  3     1000    1000
 4 -   0.0120W       -        -    4  4  4  4     5000   10000
 5 -   0.0060W       -        -    5  5  5  5   100000   50000

Supported LBA Sizes (NSID 0x1)
Id Fmt  Data  Metadt  Rel_Perf
 0 +     512       0         2
 1 -    4096       0         1

=== START OF SMART DATA SECTION ===
SMART overall-health self-assessment test result: PASSED

SMART/Health Information (NVMe Log 0x02, NSID 0xffffffff)
Critical Warning:                   0x00
Temperature:                        35 Celsius
Available Spare:                    100%
Available Spare Threshold:          10%
Percentage Used:                    30%
Data Units Read:                    45,264,283 [23.1 TB]
Data Units Written:                 71,529,613 [36.6 TB]
Host Read Commands:                 592,607,375
Host Write Commands:                807,715,928
Controller Busy Time:               7,383
Power Cycles:                       9,009
Power On Hours:                     23,145
Unsafe Shutdowns:                   817
Media and Data Integrity Errors:    0
Error Information Log Entries:      0
Warning  Comp. Temperature Time:    0
Critical Comp. Temperature Time:    0
Temperature Sensor 1:               35 Celsius

Error Information (NVMe Log 0x01, 16 of 128 entries)
No Errors Logged

Warning: self-test output truncated to 19 items to workaround controller bug
Self-test Log (NVMe Log 0x06, NSID 0xffffffff)
Self-test status: No self-test in progress
No Self-tests Logged

