smartctl 7.5 2025-04-30 r5714 [x86_64-w64-mingw32-w11-b26220] (AppVeyor)
Copyright (C) 2002-25, Bruce Allen, Christian Franke, www.smartmontools.org

=== START OF INFORMATION SECTION ===
Model Number:                       Samsung SSD 9100 PRO 2TB
Serial Number:                      ****822D
Firmware Version:                   0B2QNXH7
PCI Vendor/Subsystem ID:            0x144d
IEEE OUI Identifier:                0x002538
Total NVM Capacity:                 2,000,398,934,016 [2.00 TB]
Unallocated NVM Capacity:           0
Controller ID:                      1
NVMe Version:                       2.0
Number of Namespaces:               1
Namespace 1 Size/Capacity:          2,000,398,934,016 [2.00 TB]
Namespace 1 Utilization:            1,159,530,422,272 [1.15 TB]
Namespace 1 Formatted LBA Size:     512
Namespace 1 IEEE EUI-64: [redacted]
Local Time is:                      Fri Jul 24 11:13:51 2026 EDT
Firmware Updates (0x16):            3 Slots, no Reset required
Optional Admin Commands (0x0017):   Security Format Frmw_DL Self_Test
Optional NVM Commands (0x005d):     Comp DS_Mngmt Wr_Zero Sav/Sel_Feat Timestmp
Log Page Attributes (0x7f):         S/H_per_NS Cmd_Eff_Lg Ext_Get_Lg Telmtry_Lg Pers_Ev_Lg Log0_FISE_MI Telmtry_Ar_4
Maximum Data Transfer Size:         128 Pages
Warning  Comp. Temp. Threshold:     84 Celsius
Critical Comp. Temp. Threshold:     88 Celsius

Supported Power States
St Op     Max   Active     Idle   RL RT WL WT  Ent_Lat  Ex_Lat
 0 +     8.70W       -        -    0  0  0  0      600     600
 1 +     8.70W       -        -    1  1  1  1      600     600
 2 +     8.70W       -        -    2  2  2  2      600     600
 3 -   0.0500W       -        -    3  3  3  3     2500   12500
 4 -   0.0050W       -        -    4  4  4  4     4000   46000

Supported LBA Sizes (NSID 0x1)
Id Fmt  Data  Metadt  Rel_Perf
 0 +     512       0         0

=== START OF SMART DATA SECTION ===
SMART overall-health self-assessment test result: PASSED

SMART/Health Information (NVMe Log 0x02, NSID 0xffffffff)
Critical Warning:                   0x00
Temperature:                        56 Celsius
Available Spare:                    100%
Available Spare Threshold:          10%
Percentage Used:                    0%
Data Units Read:                    14,306,422 [7.32 TB]
Data Units Written:                 18,113,949 [9.27 TB]
Host Read Commands:                 487,383,224
Host Write Commands:                245,686,481
Controller Busy Time:               863
Power Cycles:                       115
Power On Hours:                     211
Unsafe Shutdowns:                   37
Media and Data Integrity Errors:    0
Error Information Log Entries:      0
Warning  Comp. Temperature Time:    1
Critical Comp. Temperature Time:    0
Temperature Sensor 1:               62 Celsius
Temperature Sensor 2:               56 Celsius
Thermal Temp. 1 Transition Count:   25
Thermal Temp. 1 Total Time:         624

Error Information (NVMe Log 0x01, 16 of 64 entries)
No Errors Logged

Self-test Log (NVMe Log 0x06, NSID 0xffffffff)
Self-test status: No self-test in progress
Num  Test_Description  Status                       Power_on_Hours  Failing_LBA  NSID Seg SCT Code
 0   Short             Completed without error                 211            -     -   -   -    -
 1   Short             Completed without error                   2            -     -   -   -    -

