smartctl 7.5 2025-04-30 r5714 [x86_64-linux-7.0.14-6-pve] (local build)
Copyright (C) 2002-25, Bruce Allen, Christian Franke, www.smartmontools.org

=== START OF INFORMATION SECTION ===
Model Family:     Crucial/Micron Client SSDs
Device Model:     CT2000BX500SSD1
Serial Number:    ****B600
LU WWN Device Id: [redacted]
Firmware Version: M6CR082
User Capacity:    2,000,398,934,016 bytes [2.00 TB]
Sector Size:      512 bytes logical/physical
Rotation Rate:    Solid State Device
Form Factor:      2.5 inches
TRIM Command:     Available
Device is:        In smartctl database 7.5/5706
ATA Version is:   ACS-3 T13/2161-D revision 4
SATA Version is:  SATA 3.3, 6.0 Gb/s (current: 6.0 Gb/s)
Local Time is:    Fri Jul 24 10:20:40 2026 EDT
SMART support is: Available - device has SMART capability.
SMART support is: Enabled

=== START OF READ SMART DATA SECTION ===
SMART overall-health self-assessment test result: PASSED

General SMART Values:
Offline data collection status:  (0x02)	Offline data collection activity
					was completed without error.
					Auto Offline Data Collection: Disabled.
Self-test execution status:      (   0)	The previous self-test routine completed
					without error or no self-test has ever 
					been run.
Total time to complete Offline 
data collection: 		(  120) seconds.
Offline data collection
capabilities: 			 (0x11) SMART execute Offline immediate.
					No Auto Offline data collection support.
					Suspend Offline collection upon new
					command.
					No Offline surface scan supported.
					Self-test supported.
					No Conveyance Self-test supported.
					No Selective Self-test supported.
SMART capabilities:            (0x0002)	Does not save SMART data before
					entering power-saving mode.
					Supports SMART auto save timer.
Error logging capability:        (0x01)	Error logging supported.
					General Purpose Logging supported.
Short self-test routine 
recommended polling time: 	 (   2) minutes.
Extended self-test routine
recommended polling time: 	 (  10) minutes.

SMART Attributes Data Structure revision number: 16
Vendor Specific SMART Attributes with Thresholds:
ID# ATTRIBUTE_NAME          FLAG     VALUE WORST THRESH TYPE      UPDATED  WHEN_FAILED RAW_VALUE
  1 Raw_Read_Error_Rate     0x002f   100   100   000    Pre-fail  Always       -       0
  5 Reallocate_NAND_Blk_Cnt 0x0032   100   100   010    Old_age   Always       -       0
  9 Power_On_Hours          0x0032   100   100   000    Old_age   Always       -       8023
 12 Power_Cycle_Count       0x0032   100   100   000    Old_age   Always       -       45
171 Program_Fail_Count      0x0032   100   100   000    Old_age   Always       -       0
172 Erase_Fail_Count        0x0032   100   100   000    Old_age   Always       -       0
173 Ave_Block-Erase_Count   0x0032   098   098   000    Old_age   Always       -       17
174 Unexpect_Power_Loss_Ct  0x0032   100   100   000    Old_age   Always       -       32
180 Unused_Reserve_NAND_Blk 0x0033   100   100   000    Pre-fail  Always       -       41
183 SATA_Interfac_Downshift 0x0032   100   100   000    Old_age   Always       -       0
184 Error_Correction_Count  0x0032   100   100   000    Old_age   Always       -       0
187 Reported_Uncorrect      0x0032   100   100   000    Old_age   Always       -       0
194 Temperature_Celsius     0x0022   070   061   000    Old_age   Always       -       30 (Min/Max 21/39)
196 Reallocated_Event_Count 0x0032   100   100   000    Old_age   Always       -       0
197 Current_Pending_ECC_Cnt 0x0032   100   100   000    Old_age   Always       -       0
198 Offline_Uncorrectable   0x0030   100   100   000    Old_age   Offline      -       0
199 UDMA_CRC_Error_Count    0x0032   100   100   000    Old_age   Always       -       0
202 Percent_Lifetime_Remain 0x0030   098   098   001    Old_age   Offline      -       2
206 Write_Error_Rate        0x000e   100   100   000    Old_age   Always       -       0
210 Success_RAIN_Recov_Cnt  0x0032   100   100   000    Old_age   Always       -       0
246 Total_LBAs_Written      0x0032   100   100   000    Old_age   Always       -       32228602798
247 Host_Program_Page_Count 0x0032   100   100   000    Old_age   Always       -       1007143837
248 FTL_Program_Page_Count  0x0032   100   100   000    Old_age   Always       -       1399867392
249 Unkn_CrucialMicron_Attr 0x0032   100   100   000    Old_age   Always       -       0
250 Read_Error_Retry_Rate   0x0032   100   100   000    Old_age   Always       -       489
251 Unkn_CrucialMicron_Attr 0x0032   100   100   000    Old_age   Always       -       1859381312
252 Unkn_CrucialMicron_Attr 0x0032   100   100   000    Old_age   Always       -       10
253 Unkn_CrucialMicron_Attr 0x0032   100   100   000    Old_age   Always       -       0
254 Unkn_CrucialMicron_Attr 0x0032   100   100   000    Old_age   Always       -       42570604384
255 Unknown_Attribute       0x0032   100   100   000    Old_age   Always       -       92633089536

SMART Error Log not supported

SMART Self-test log structure revision number 1
Num  Test_Description    Status                  Remaining  LifeTime(hours)  LBA_of_first_error
# 1  Short offline       Completed without error       00%      8023         -
# 2  Short offline       Completed without error       00%        65         -

Selective Self-tests/Logging not supported

The above only provides legacy SMART information - try 'smartctl -x' for more

