smartctl 7.5 2025-04-30 r5714 [x86_64-linux-7.0.2-6-pve] (local build)
Copyright (C) 2002-25, Bruce Allen, Christian Franke, www.smartmontools.org

=== START OF INFORMATION SECTION ===
Model Family:     Hitachi Travelstar Z7K320
Device Model:     HITACHI HTS723232A7A364
Serial Number: <YOUR_DRIVE_SERIAL>
LU WWN Device Id: <YOUR_DRIVE_WWN>
Firmware Version: EC2ZB70B
User Capacity:    320,072,933,376 bytes [320 GB]
Sector Size:      512 bytes logical/physical
Rotation Rate:    7200 rpm
Form Factor:      2.5 inches
Device is:        In smartctl database 7.5/5706
ATA Version is:   ATA8-ACS T13/1699-D revision 6
SATA Version is:  SATA 2.6, 1.5 Gb/s (current: 1.5 Gb/s)
Local Time is:    Fri Jul 31 10:24:57 2026 EDT
SMART support is: Available - device has SMART capability.
SMART support is: Enabled
AAM feature is:   Unavailable
APM level is:     254 (maximum performance)
Rd look-ahead is: Enabled
Write cache is:   Enabled
DSN feature is:   Unavailable
ATA Security is:  Disabled, frozen [SEC2], Master PW ID: 0x0001

=== START OF READ SMART DATA SECTION ===
SMART overall-health self-assessment test result: PASSED

General SMART Values:
Offline data collection status:  (0x00)	Offline data collection activity
					was never started.
					Auto Offline Data Collection: Disabled.
Self-test execution status:      ( 118)	The previous self-test completed having
					the read element of the test failed.
Total time to complete Offline 
data collection: 		(   45) seconds.
Offline data collection
capabilities: 			 (0x5b) SMART execute Offline immediate.
					Auto Offline data collection on/off support.
					Suspend Offline collection upon new
					command.
					Offline surface scan supported.
					Self-test supported.
					No Conveyance Self-test supported.
					Selective Self-test supported.
SMART capabilities:            (0x0003)	Saves SMART data before entering
					power-saving mode.
					Supports SMART auto save timer.
Error logging capability:        (0x01)	Error logging supported.
					General Purpose Logging supported.
Short self-test routine 
recommended polling time: 	 (   2) minutes.
Extended self-test routine
recommended polling time: 	 (  76) minutes.
SCT capabilities: 	       (0x003d)	SCT Status supported.
					SCT Error Recovery Control supported.
					SCT Feature Control supported.
					SCT Data Table supported.

SMART Attributes Data Structure revision number: 16
Vendor Specific SMART Attributes with Thresholds:
ID# ATTRIBUTE_NAME          FLAGS    VALUE WORST THRESH FAIL RAW_VALUE
  1 Raw_Read_Error_Rate     PO-R--   098   098   062    -    262145
  2 Throughput_Performance  P-S---   100   100   040    -    0
  3 Spin_Up_Time            POS---   253   253   033    -    1
  4 Start_Stop_Count        -O--C-   100   100   000    -    766
  5 Reallocated_Sector_Ct   PO--CK   100   100   005    -    0
  7 Seek_Error_Rate         PO-R--   100   100   067    -    0
  8 Seek_Time_Performance   P-S---   100   100   040    -    0
  9 Power_On_Hours          -O--C-   001   001   000    -    43950
 10 Spin_Retry_Count        PO--C-   100   100   060    -    0
 12 Power_Cycle_Count       -O--CK   100   100   000    -    757
191 G-Sense_Error_Rate      -O-R--   099   099   000    -    2
192 Power-Off_Retract_Count -O--CK   100   100   000    -    1307181083
193 Load_Cycle_Count        -O--C-   001   001   000    -    1887647
194 Temperature_Celsius     -O----   171   171   000    -    35 (Min/Max 10/47)
196 Reallocated_Event_Count -O--CK   100   100   000    -    0
197 Current_Pending_Sector  -O---K   100   100   000    -    2
198 Offline_Uncorrectable   ---R--   100   100   000    -    0
199 UDMA_CRC_Error_Count    -O-R--   200   200   000    -    0
223 Load_Retry_Count        -O-R--   100   100   000    -    0
                            ||||||_ K auto-keep
                            |||||__ C event count
                            ||||___ R error rate
                            |||____ S speed/performance
                            ||_____ O updated online
                            |______ P prefailure warning

General Purpose Log Directory Version 1
SMART           Log Directory Version 1 [multi-sector log support]
Address    Access  R/W   Size  Description
0x00       GPL,SL  R/O      1  Log Directory
0x01           SL  R/O      1  Summary SMART error log
0x02           SL  R/O      1  Comprehensive SMART error log
0x03       GPL     R/O      1  Ext. Comprehensive SMART error log
0x04       GPL     R/O      7  Device Statistics log
0x06           SL  R/O      1  SMART self-test log
0x07       GPL     R/O      1  Extended self-test log
0x09           SL  R/W      1  Selective self-test log
0x10       GPL     R/O      1  NCQ Command Error log
0x11       GPL     R/O      1  SATA Phy Event Counters log
0x80-0x9f  GPL,SL  R/W     16  Host vendor specific log
0xe0       GPL,SL  R/W      1  SCT Command/Status
0xe1       GPL,SL  R/W      1  SCT Data Transfer

SMART Extended Comprehensive Error Log Version: 1 (1 sectors)
No Errors Logged

SMART Extended Self-test Log Version: 1 (1 sectors)
Num  Test_Description    Status                  Remaining  LifeTime(hours)  LBA_of_first_error
# 1  Extended offline    Completed: read failure       60%     43950         246502720

SMART Selective self-test log data structure revision number 1
 SPAN  MIN_LBA  MAX_LBA  CURRENT_TEST_STATUS
    1        0        0  Not_testing
    2        0        0  Not_testing
    3        0        0  Not_testing
    4        0        0  Not_testing
    5        0        0  Not_testing
Selective self-test flags (0x0):
  After scanning selected spans, do NOT read-scan remainder of disk.
If Selective self-test is pending on power-up, resume after 0 minute delay.

SCT Status Version:                  3
SCT Version (vendor specific):       256 (0x0100)
Device State:                        Active (0)
Current Temperature:                    34 Celsius
Power Cycle Min/Max Temperature:     32/41 Celsius
Lifetime    Min/Max Temperature:     10/47 Celsius
Specified Max Operating Temperature:    34 Celsius
Under/Over Temperature Limit Count:   0/0

SCT Temperature History Version:     2
Temperature Sampling Period:         1 minute
Temperature Logging Interval:        1 minute
Min/Max recommended Temperature:      0/60 Celsius
Min/Max Temperature Limit:           -40/65 Celsius
Temperature History Size (Index):    128 (8)

Index    Estimated Time   Temperature Celsius
   9    2026-07-31 08:17    32  *************
 ...    ..(  2 skipped).    ..  *************
  12    2026-07-31 08:20    32  *************
  13    2026-07-31 08:21    33  **************
 ...    ..(  5 skipped).    ..  **************
  19    2026-07-31 08:27    33  **************
  20    2026-07-31 08:28    34  ***************
 ...    ..( 20 skipped).    ..  ***************
  41    2026-07-31 08:49    34  ***************
  42    2026-07-31 08:50    33  **************
  43    2026-07-31 08:51    34  ***************
  44    2026-07-31 08:52    34  ***************
  45    2026-07-31 08:53    34  ***************
  46    2026-07-31 08:54    33  **************
 ...    ..( 53 skipped).    ..  **************
 100    2026-07-31 09:48    33  **************
 101    2026-07-31 09:49    35  ****************
 102    2026-07-31 09:50    35  ****************
 103    2026-07-31 09:51    36  *****************
 104    2026-07-31 09:52    37  ******************
 105    2026-07-31 09:53    37  ******************
 106    2026-07-31 09:54    38  *******************
 107    2026-07-31 09:55    38  *******************
 108    2026-07-31 09:56    39  ********************
 109    2026-07-31 09:57    39  ********************
 110    2026-07-31 09:58    40  *********************
 ...    ..(  3 skipped).    ..  *********************
 114    2026-07-31 10:02    40  *********************
 115    2026-07-31 10:03    41  **********************
 ...    ..(  8 skipped).    ..  **********************
 124    2026-07-31 10:12    41  **********************
 125    2026-07-31 10:13    39  ********************
 126    2026-07-31 10:14    38  *******************
 127    2026-07-31 10:15    38  *******************
   0    2026-07-31 10:16    37  ******************
   1    2026-07-31 10:17    37  ******************
   2    2026-07-31 10:18    36  *****************
   3    2026-07-31 10:19    36  *****************
   4    2026-07-31 10:20    35  ****************
 ...    ..(  3 skipped).    ..  ****************
   8    2026-07-31 10:24    35  ****************

SCT Error Recovery Control:
           Read: Disabled
          Write: Disabled

Device Statistics (GP Log 0x04)
Page  Offset Size        Value Flags Description
0x01  =====  =               =  ===  == General Statistics (rev 1) ==
0x01  0x008  4             757  ---  Lifetime Power-On Resets
0x01  0x010  4           43950  ---  Power-on Hours
0x01  0x018  6    189024297752  ---  Logical Sectors Written
0x01  0x020  6      3145936918  ---  Number of Write Commands
0x01  0x028  6    607511551022  ---  Logical Sectors Read
0x01  0x030  6      4556364565  ---  Number of Read Commands
0x03  =====  =               =  ===  == Rotating Media Statistics (rev 1) ==
0x03  0x008  4           42889  ---  Spindle Motor Power-on Hours
0x03  0x010  4           42741  ---  Head Flying Hours
0x03  0x018  4         1887647  ---  Head Load Events
0x03  0x020  4               0  ---  Number of Reallocated Logical Sectors
0x03  0x028  4            1242  ---  Read Recovery Attempts
0x03  0x030  4               0  ---  Number of Mechanical Start Failures
0x04  =====  =               =  ===  == General Errors Statistics (rev 1) ==
0x04  0x008  4               0  ---  Number of Reported Uncorrectable Errors
0x04  0x010  4            2398  ---  Resets Between Cmd Acceptance and Completion
0x05  =====  =               =  ===  == Temperature Statistics (rev 1) ==
0x05  0x008  1              34  ---  Current Temperature
0x05  0x010  1              34  N--  Average Short Term Temperature
0x05  0x018  1              34  N--  Average Long Term Temperature
0x05  0x020  1              47  ---  Highest Temperature
0x05  0x028  1              10  ---  Lowest Temperature
0x05  0x030  1              39  N--  Highest Average Short Term Temperature
0x05  0x038  1              25  N--  Lowest Average Short Term Temperature
0x05  0x040  1              37  N--  Highest Average Long Term Temperature
0x05  0x048  1              25  N--  Lowest Average Long Term Temperature
0x05  0x050  4               0  ---  Time in Over-Temperature
0x05  0x058  1              60  ---  Specified Maximum Operating Temperature
0x05  0x060  4               0  ---  Time in Under-Temperature
0x05  0x068  1               0  ---  Specified Minimum Operating Temperature
0x06  =====  =               =  ===  == Transport Statistics (rev 1) ==
0x06  0x008  4            4646  ---  Number of Hardware Resets
0x06  0x010  4             780  ---  Number of ASR Events
0x06  0x018  4               0  ---  Number of Interface CRC Errors
                                |||_ C monitored condition met
                                ||__ D supports DSN
                                |___ N normalized value

Pending Defects log (GP Log 0x0c) not supported

SATA Phy Event Counters (GP Log 0x11)
ID      Size     Value  Description
0x0001  2            0  Command failed due to ICRC error
0x0002  2            0  R_ERR response for data FIS
0x0003  2            0  R_ERR response for device-to-host data FIS
0x0004  2            0  R_ERR response for host-to-device data FIS
0x0005  2            0  R_ERR response for non-data FIS
0x0006  2            0  R_ERR response for device-to-host non-data FIS
0x0007  2            0  R_ERR response for host-to-device non-data FIS
0x0009  2         2324  Transition from drive PhyRdy to drive PhyNRdy
0x000a  2            8  Device-to-host register FISes sent due to a COMRESET
0x000b  2            0  CRC errors within host-to-device FIS
0x000d  2            0  Non-CRC errors within host-to-device FIS

